<?xml version="1.0" encoding="UTF-8" ?>
<!--
  ~ Copyright (c) 2011 by Daniel Hodan <daniel.hodan@anyd.cz>.
  ~
  ~ This file is part of Tarsius.
  ~
  ~ Tarsius is free software; you can redistribute it and/or modify
  ~ it under the terms of the GNU General Public License as published by
  ~ the Free Software Foundation, either version 3 of the License, or
  ~ (at your option) any later version.
  ~
  ~ Tarsius is distributed in the hope that it will be useful,
  ~ but WITHOUT ANY WARRANTY; without even the implied warranty of
  ~ MERCHANTABILITY or FITNESS FOR A PARTICULAR PURPOSE.  See the
  ~ GNU General Public License for more details.
  ~
  ~ You should have received a copy of the GNU General Public License
  ~ along with Tarsius. If not, see <http://www.gnu.org/licenses/>.
  -->

<add xmlns:xsi="http://www.w3.org/2001/XMLSchema-instance" xsi:noNamespaceSchemaLocation="add.xsd">

    <description>Databases packages></description>

    <package name="postgresql">
        <parser class="cz.anyd.updater.parser.app.ClosureParser">
            <param1>http://www.postgresql.org/versions.rss</param1>
            <param2><![CDATA[new XmlSlurper().parseText(it).channel.item[0].title]]></param2>
        </parser>
        <tags>
            <tag>postgresql</tag>
            <tag>database</tag>
            <tag>relational</tag>
        </tags>
    </package>

    <package name="mysql">
        <parser class="cz.anyd.updater.parser.app.HtmlPageParser">
            <param1>http://www.mysql.com/downloads</param1>
            <param2><![CDATA[MySQL Community Server<\/a><span(?:[^>]*)>\(Current Generally Available Release: (.*?)\)<\/span>]]></param2>
        </parser>
        <tags>
            <tag>mysql</tag>
            <tag>database</tag>
            <tag>relational</tag>
        </tags>
    </package>

    <package name="sqlite">
        <parser class="cz.anyd.updater.parser.app.HtmlPageParser">
            <param1>http://www.sqlite.org</param1>
            <param2><![CDATA[Version (.*?)<\/a>\s+of SQLite is recommended for all new development.]]></param2>
        </parser>
        <tags>
            <tag>sqlite</tag>
            <tag>database</tag>
            <tag>relational</tag>
        </tags>
    </package>

    <package name="mongodb">
        <parser class="cz.anyd.updater.parser.app.HtmlPageParser">
            <param1>http://www.mongodb.org/downloads</param1>
            <param2><![CDATA[<div class="version">\s+(.*)\s+<\/div>]]></param2>
        </parser>
        <tags>
            <tag>mongodb</tag>
            <tag>database</tag>
            <tag>nosql</tag>
        </tags>
    </package>

    <package name="redis">
        <parser class="cz.anyd.updater.parser.app.HtmlPageParser">
            <param1>http://www.redis.io</param1>
            <param2><![CDATA[<a(?:[^>]*)>Redis (.*?) is the latest stable version.<\/a>]]></param2>
        </parser>
        <tags>
            <tag>redis</tag>
            <tag>database</tag>
            <tag>nosql</tag>
        </tags>
    </package>

    <package name="couchdb">
        <parser class="cz.anyd.updater.parser.app.HtmlPageParser">
            <param1>http://couchdb.apache.org/downloads.html</param1>
            <param2><![CDATA[<h3>(.*)<\/h3>]]></param2>
        </parser>
        <tags>
            <tag>couchdb</tag>
            <tag>database</tag>
            <tag>nosql</tag>
        </tags>
    </package>

    <package name="firebird">
        <parser class="cz.anyd.updater.parser.app.HtmlPageParser">
            <param1>http://www.ibphoenix.com/download</param1>
            <param2><![CDATA[<a href=\"\/download\/firebird\/25\"> (.*?)<\/a>]]></param2>
        </parser>
        <tags>
            <tag>firebird</tag>
            <tag>database</tag>
            <tag>relational</tag>
        </tags>
    </package>

</add>