<?xml version="1.0" encoding="UTF-8" ?>
<!--
  ~ Copyright (c) 2011 by Daniel Hodan <daniel.hodan@anyd.cz>.
  ~
  ~ This file is part of Tarsius.
  ~
  ~ Tarsius is free software; you can redistribute it and/or modify
  ~ it under the terms of the GNU General Public License as published by
  ~ the Free Software Foundation, either version 3 of the License, or
  ~ (at your option) any later version.
  ~
  ~ Tarsius is distributed in the hope that it will be useful,
  ~ but WITHOUT ANY WARRANTY; without even the implied warranty of
  ~ MERCHANTABILITY or FITNESS FOR A PARTICULAR PURPOSE.  See the
  ~ GNU General Public License for more details.
  ~
  ~ You should have received a copy of the GNU General Public License
  ~ along with Tarsius. If not, see <http://www.gnu.org/licenses/>.
  -->

<add xmlns:xsi="http://www.w3.org/2001/XMLSchema-instance" xsi:noNamespaceSchemaLocation="add.xsd">

    <description>Instant messanger packages</description>

    <package name="pidgin">
        <parser class="cz.anyd.updater.parser.app.HtmlPageParser">
            <param1>http://www.pidgin.im/</param1>
            <param2><![CDATA[Pidgin (.*?) is out]]></param2>
        </parser>
        <tags>
            <tag>pidgin</tag>
            <tag>instant messaging</tag>
            <tag>gtk</tag>
        </tags>
    </package>

    <package name="gajim">
        <parser class="cz.anyd.updater.parser.app.HtmlPageParser">
            <param1>http://www.gajim.org</param1>
            <param2><![CDATA[Gajim (.*?) is here]]></param2>
        </parser>
        <tags>
            <tag>gajim</tag>
            <tag>instant messaging</tag>
            <tag>gtk</tag>
        </tags>
    </package>

</add>