<?xml version="1.0" encoding="UTF-8" ?>
<!--
  ~ Copyright (c) 2011 by Daniel Hodan <daniel.hodan@anyd.cz>.
  ~
  ~ This file is part of Tarsius.
  ~
  ~ Tarsius is free software; you can redistribute it and/or modify
  ~ it under the terms of the GNU General Public License as published by
  ~ the Free Software Foundation, either version 3 of the License, or
  ~ (at your option) any later version.
  ~
  ~ Tarsius is distributed in the hope that it will be useful,
  ~ but WITHOUT ANY WARRANTY; without even the implied warranty of
  ~ MERCHANTABILITY or FITNESS FOR A PARTICULAR PURPOSE.  See the
  ~ GNU General Public License for more details.
  ~
  ~ You should have received a copy of the GNU General Public License
  ~ along with Tarsius. If not, see <http://www.gnu.org/licenses/>.
  -->

<add xmlns:xsi="http://www.w3.org/2001/XMLSchema-instance" xsi:noNamespaceSchemaLocation="add.xsd">

    <description>Mail packages</description>

    <package name="evolution">
        <parser class="cz.anyd.updater.parser.app.HtmlPageParser">
            <param1>http://projects.gnome.org/evolution/download.shtml</param1>
            <param2><![CDATA[Evolution<\/a><\/td>\s+<td>(.*?)<\/td>]]></param2>
        </parser>
        <tags>
            <tag>evolution</tag>
            <tag>mail</tag>
            <tag>email client</tag>
        </tags>
    </package>

    <package name="mutt">
        <parser class="cz.anyd.updater.parser.app.HtmlPageParser">
            <param1>http://www.mutt.org/</param1>
            <param2><![CDATA[<h3>Stable<\/h3>\s+<p>\s+Mutt (.*?) was released]]></param2>
        </parser>
        <tags>
            <tag>mutt</tag>
            <tag>mail</tag>
            <tag>email client</tag>
        </tags>
    </package>

    <package name="pine">
        <parser class="cz.anyd.updater.parser.app.HtmlPageParser">
            <param1>http://www.washington.edu/pine/getpine/linux.html</param1>
            <param2><![CDATA[pine_(.*?)_i386.deb]]></param2>
        </parser>
        <tags>
            <tag>pine</tag>
            <tag>mail</tag>
            <tag>email client</tag>
        </tags>
    </package>

    <package name="alpine">
        <parser class="cz.anyd.updater.parser.app.HtmlPageParser">
            <param1>http://www.washington.edu/alpine/acquire/</param1>
            <param2><![CDATA[alpine_(.*?)_i386.deb]]></param2>
        </parser>
        <tags>
            <tag>alpine</tag>
            <tag>mail</tag>
            <tag>email client</tag>
        </tags>
    </package>

    <package name="claws">
        <parser class="cz.anyd.updater.parser.app.HtmlPageParser">
            <param1>http://www.claws-mail.org/news.php</param1>
            <param2><![CDATA[Claws Mail (.*?)<b]]></param2>
        </parser>
        <tags>
            <tag>claws</tag>
            <tag>mail</tag>
            <tag>email client</tag>
        </tags>
    </package>

    <package name="sylpheed">
        <parser class="cz.anyd.updater.parser.app.HtmlPageParser">
            <param1>http://sylpheed.sraoss.jp/en/</param1>
            <param2><![CDATA[<span(?:[^>]*)>Version (.*?)<\/span>]]></param2>
        </parser>
        <tags>
            <tag>sylpheed</tag>
            <tag>mail</tag>
            <tag>email client</tag>
        </tags>
    </package>

    <package name="thunderbird">
        <parser class="cz.anyd.updater.parser.app.HtmlPageParser">
            <param1>http://releases.mozilla.org/pub/mozilla.org/thunderbird/releases/latest/linux-i686/en-US/</param1>
            <param2><![CDATA[<a(?:[^>]*)>thunderbird-(.*?).tar.bz2<\/a>]]></param2>
        </parser>
        <tags>
            <tag>thunderbird</tag>
            <tag>mail</tag>
            <tag>email client</tag>
        </tags>
    </package>

    <package name="dovecot">
        <parser class="cz.anyd.updater.parser.app.HtmlPageParser">
            <param1>http://www.dovecot.org/</param1>
            <param2><![CDATA[Released <a(?:[^>]*?)>\s+v(.*?)</a>]]></param2>
        </parser>
        <tags>
            <tag>dovecot</tag>
            <tag>mail</tag>
            <tag>mta</tag>
        </tags>
    </package>

    <package name="exim">
        <parser class="cz.anyd.updater.parser.app.HtmlPageParser">
            <param1>http://www.exim.org/</param1>
            <param2><![CDATA[<h2>Latest Version: (.*?)<\/h2>]]></param2>
        </parser>
        <tags>
            <tag>exim</tag>
            <tag>mail</tag>
            <tag>mta</tag>
        </tags>
    </package>

    <package name="fetchmail">
        <parser class="cz.anyd.updater.parser.app.HtmlPageParser">
            <param1>http://fetchmail.berlios.de/index.html</param1>
            <param2><![CDATA[<h1>NEWS: FETCHMAIL (.*?) RELEASE<\/h1>]]></param2>
        </parser>
        <tags>
            <tag>fetchmail</tag>
            <tag>mail</tag>
            <tag>email client</tag>
        </tags>
    </package>

    <package name="postfix">
        <parser class="cz.anyd.updater.parser.app.HtmlPageParser">
            <param1>http://ftp.porcupine.org/mirrors/postfix-release/index.html</param1>
            <param2><![CDATA[<a href=\"official\/postfix-(.*?).tar.gz\">Source code<\/a>]]></param2>
        </parser>
        <tags>
            <tag>postfix</tag>
            <tag>mail</tag>
            <tag>mta</tag>
        </tags>
    </package>

    <package name="courier">
        <parser class="cz.anyd.updater.parser.app.HtmlPageParser">
            <param1>http://www.courier-mta.org/download.php</param1>
            <param2><![CDATA[courier-(.*?).tar.bz2]]></param2>
        </parser>
        <tags>
            <tag>courier</tag>
            <tag>mail</tag>
            <tag>mta</tag>
        </tags>
    </package>

    <package name="cyrus">
        <parser class="cz.anyd.updater.parser.app.HtmlPageParser">
            <param1>http://www.cyrusimap.org/</param1>
            <param2><![CDATA[<p>Version: (.*?)<\/p>]]></param2>
        </parser>
        <tags>
            <tag>cyrus</tag>
            <tag>mail</tag>
            <tag>mta</tag>
        </tags>
    </package>

    <package name="bogofilter">
        <parser class="cz.anyd.updater.parser.app.HtmlPageParser">
            <param1>http://bogofilter.sourceforge.net/</param1>
            <param2><![CDATA[<font(?:[^>]*?)>&nbsp;v(.*?)\s+<\/font>]]></param2>
        </parser>
        <tags>
            <tag>bogofilter</tag>
            <tag>mail</tag>
            <tag>spam filter</tag>
        </tags>
    </package>

    <package name="spamassassin">
        <parser class="cz.anyd.updater.parser.app.HtmlPageParser">
            <param1>http://spamassassin.apache.org/downloads.cgi</param1>
            <param2><![CDATA[<h3>Released version, (.*?)<\/h3>]]></param2>
        </parser>
        <tags>
            <tag>spamassassin</tag>
            <tag>mail</tag>
            <tag>spam filter</tag>
        </tags>
    </package>

    <package name="kolab">
        <parser class="cz.anyd.updater.parser.app.HtmlPageParser">
            <param1>http://www.kolab.org/download.html</param1>
            <param2><![CDATA[current stable release (.*?)\s+]]></param2>
        </parser>
        <tags>
            <tag>kolab</tag>
            <tag>groupware</tag>
        </tags>
    </package>

    <package name="citadel">
        <parser class="cz.anyd.updater.parser.app.HtmlPageParser">
            <param1>http://www.citadel.org/doku.php?id=news:start</param1>
            <param2><![CDATA[<a(?:[^>]*)>Citadel (.*?) released<\/a>]]></param2>
        </parser>
        <tags>
            <tag>citadel</tag>
            <tag>mail</tag>
            <tag>groupware</tag>
        </tags>
    </package>

</add>